title,link,date
Five Tips to Manage the Emotional Side of a Coding Program,/blog/five-tips-emotional-management,2018-10-08
Does Emotional Intelligence Get You Paid More in Tech?,/blog/emotional-intelligence,2018-10-03
Post-Outcomes Blog: Top 3 Insights for Job-Seekers,/blog/insights-job-seekers,2018-09-27
"Staff Spotlight - Megan Lane, Operations & Events Associate",/blog/staff-spotlight-megan-lane,2018-09-11
Different Approaches to Using Relational Databases with Express,/blog/different-approaches-express,2018-08-28
The Job Funnel,/blog/the-job-funnel,2018-08-20
Alumni Spotlight: Daniel Szabo,/blog/alumni-spotlight-daniel,2018-08-08
Rithm School Interview FAQs,/blog/rithm-interview-faqs,2018-08-01
BPPE Approval and Outcomes Numbers,/blog/bppe-approval-and-outcomes-numbers,2018-07-25
Whats New in Python 3.7: Data Classes,/blog/whats-new-in-python-3-7,2018-07-11
